{
  "id": "0lg005",
  "type": "axiom",
  "domain": "mathematics",
  "title": "Modus Tollens",
  "status": "stable",
  "content": "If (P → Q) is true, and Q is false, then P must be false. This is the logical basis for proof by contrapositive and falsification.",
  "formal": "P → Q, ¬Q ⊢ ¬P",
  "tags": ["logic", "inference", "classical_logic", "foundations"],
  "metadata": {
    "importance": 9,
    "certainty": 1.0,
    "foundational_system": "ClassicalLogic",
    "contested": false
  },
  "sources": ["stoic_logic"],
  "created": "2025-11-18T20:00:00Z"
}
